{
  "title": "Above the Cloud at Triund",
  "date": "2026-10-18",
  "excerpt": "From the market lanes of McLeod Ganj to the Triund ridge in June: a walk up through the cloud forest, a dog at the halfway point, and the Dhauladhar after the cloud broke.",
  "cover": "triund-2026/trail-01.avif",
  "labels": ["triund-2026"],
  "featured": false,
  "draft": false
}
