{
  "title": "Walking into the Valley of Flowers",
  "date": "2026-10-18",
  "excerpt": "September in the Valley of Flowers: a sky that never lifted, meadows turning white with the late bloom, and why grey light suited it better than sunshine.",
  "cover": "valley-of-flowers-2026/flower-meadow-01.avif",
  "labels": ["valley-of-flowers-2026"],
  "featured": true,
  "draft": false
}
